{
  "schema_version" : "1.0.0",
  "run_id" : "RUN-01M293KJ0RYV603B3JB0CCJJN9",
  "generated_at" : "2026-09-11T21:32:33.303906900Z",
  "attempt_count" : 24,
  "purpose" : "Ordered record of every stage attempt in this run, including attempts that refused, failed or crashed. Written after each attempt so it survives a run that never reaches finalization.",
  "entries" : [ {
    "stage_id" : "00-bootstrap",
    "stage_name" : "RunBootstrap",
    "attempt_id" : "01M293KJG55B1BR5B5RV0V29VJ",
    "edge_id" : null,
    "trigger" : "PIPELINE",
    "start" : "2026-09-11T20:47:35.941203100Z",
    "end" : "2026-09-11T20:47:37.802149700Z",
    "duration_ms" : 1860,
    "status" : "SUCCESS",
    "summary" : "Workspaces created under C:\\Users\\annav\\AppData\\Local\\Temp\\bootshift-workspaces\\RUN-01M293KJ0RYV603B3JB0CCJJN9; OSS gate passed for 19 harness components",
    "state_before" : "CREATED",
    "state_after" : "OSS_POLICY_VERIFIED",
    "attempt_directory" : "20260911-204737-712",
    "stop_reason" : null,
    "next_action" : "Run: bootshift inventory --repo <path>",
    "command_count" : 0,
    "decision_count" : 0,
    "warning_count" : 1,
    "error_count" : 0,
    "unexecuted_step_count" : 0,
    "rendering_error" : null
  }, {
    "stage_id" : "01-inventory",
    "stage_name" : "InventoryStage",
    "attempt_id" : "01M293KMDEAJ9WDG12S09X41FF",
    "edge_id" : null,
    "trigger" : "PIPELINE",
    "start" : "2026-09-11T20:47:37.902532500Z",
    "end" : "2026-09-11T20:47:38.258019400Z",
    "duration_ms" : 355,
    "status" : "SUCCESS",
    "summary" : "99 files across 6 module(s); 104 migration signal(s); registry sealed as b3104303c3acb64fd340c733848a88ac76b26b2a8bc6a42892400ff870a6787d (content 3982fd4e3e180eeb)",
    "state_before" : "OSS_POLICY_VERIFIED",
    "state_after" : "FILE_REGISTRY_SEALED",
    "attempt_directory" : "20260911-204738-128",
    "stop_reason" : null,
    "next_action" : "Run: bootshift resolve-build",
    "command_count" : 0,
    "decision_count" : 0,
    "warning_count" : 0,
    "error_count" : 0,
    "unexecuted_step_count" : 0,
    "rendering_error" : null
  }, {
    "stage_id" : "02-build",
    "stage_name" : "BuildResolverStage",
    "attempt_id" : "01M293KMSJA3VR8CWG64AK4Q5X",
    "edge_id" : null,
    "trigger" : "PIPELINE",
    "start" : "2026-09-11T20:47:38.290444300Z",
    "end" : "2026-09-11T20:49:37.568098200Z",
    "duration_ms" : 119277,
    "status" : "SUCCESS",
    "summary" : "MAVEN model: 6 module(s), 962 dependency record(s), 9186 managed version(s)",
    "state_before" : "FILE_REGISTRY_SEALED",
    "state_after" : "BUILD_RESOLVED",
    "attempt_directory" : "20260911-204937-146",
    "stop_reason" : null,
    "next_action" : "Run: bootshift graph",
    "command_count" : 27,
    "decision_count" : 0,
    "warning_count" : 0,
    "error_count" : 0,
    "unexecuted_step_count" : 0,
    "rendering_error" : null
  }, {
    "stage_id" : "03-graph",
    "stage_name" : "ApplicationGraphStage",
    "attempt_id" : "01M293Q9B0ZHX41A7WA4JRKYRX",
    "edge_id" : null,
    "trigger" : "PIPELINE",
    "start" : "2026-09-11T20:49:37.632729400Z",
    "end" : "2026-09-11T20:49:41.971161700Z",
    "duration_ms" : 4338,
    "status" : "SUCCESS",
    "summary" : "839 nodes / 1852 edges, 239 symbols, attribution 0.6858, content hash 5b764c29af1e",
    "state_before" : "BUILD_RESOLVED",
    "state_after" : "GRAPH_VERIFIED",
    "attempt_directory" : "20260911-204941-679",
    "stop_reason" : null,
    "next_action" : "Run: bootshift baseline",
    "command_count" : 0,
    "decision_count" : 0,
    "warning_count" : 0,
    "error_count" : 0,
    "unexecuted_step_count" : 0,
    "rendering_error" : null
  }, {
    "stage_id" : "04-baseline",
    "stage_name" : "BaselineStage",
    "attempt_id" : "01M293QDKPGGA1R7G0H3VWVF0K",
    "edge_id" : null,
    "trigger" : "PIPELINE",
    "start" : "2026-09-11T20:49:42.006109100Z",
    "end" : "2026-09-11T20:59:08.809173100Z",
    "duration_ms" : 566803,
    "status" : "SUCCESS",
    "summary" : "Baseline sealed as dd491b5a6685134a (6 module(s) built, 12 test(s), 4/6 runtime probe(s) started)",
    "state_before" : "GRAPH_VERIFIED",
    "state_after" : "BASELINE_SEALED",
    "attempt_directory" : "20260911-204942-332",
    "stop_reason" : null,
    "next_action" : "Run: bootshift compatibility",
    "command_count" : 28,
    "decision_count" : 0,
    "warning_count" : 3,
    "error_count" : 0,
    "unexecuted_step_count" : 0,
    "rendering_error" : null
  }, {
    "stage_id" : "05-compatibility",
    "stage_name" : "CompatibilityStage",
    "attempt_id" : "01M2948Q60E41CXQP1MNC6VAGY",
    "edge_id" : null,
    "trigger" : "PIPELINE",
    "start" : "2026-09-11T20:59:08.864803500Z",
    "end" : "2026-09-11T20:59:32.225663900Z",
    "duration_ms" : 23360,
    "status" : "SUCCESS",
    "summary" : "Current state Spring Boot 2.7.12 / Java 17 / Spring Cloud 2021.0.7; 9 candidate line(s), 0 unavailable, 0 unknown internal component(s)",
    "state_before" : "BASELINE_SEALED",
    "state_after" : "COMPATIBILITY_REGISTRY_READY",
    "attempt_directory" : "20260911-205908-963",
    "stop_reason" : null,
    "next_action" : "Run: bootshift resolve-target --target auto",
    "command_count" : 0,
    "decision_count" : 0,
    "warning_count" : 0,
    "error_count" : 0,
    "unexecuted_step_count" : 0,
    "rendering_error" : null
  }, {
    "stage_id" : "06-target",
    "stage_name" : "TargetResolverStage",
    "attempt_id" : "01M2949E11X9R1AZCPVGM1MT01",
    "edge_id" : null,
    "trigger" : "PIPELINE",
    "start" : "2026-09-11T20:59:32.257125700Z",
    "end" : "2026-09-11T20:59:32.676273Z",
    "duration_ms" : 419,
    "status" : "SUCCESS",
    "summary" : "Landing target Spring Boot 3.5.16 (Java 21, Spring Cloud 2025.0.3), 8 migration edge(s), -2 month support horizon",
    "state_before" : "COMPATIBILITY_REGISTRY_READY",
    "state_after" : "TARGET_FROZEN",
    "attempt_directory" : "20260911-205932-627",
    "stop_reason" : null,
    "next_action" : "Run: bootshift documentation",
    "command_count" : 2,
    "decision_count" : 10,
    "warning_count" : 5,
    "error_count" : 0,
    "unexecuted_step_count" : 0,
    "rendering_error" : null
  }, {
    "stage_id" : "07-documentation",
    "stage_name" : "DocumentationStage",
    "attempt_id" : "01M2949EEMA8V0QZWPQN3K3G2T",
    "edge_id" : null,
    "trigger" : "PIPELINE",
    "start" : "2026-09-11T20:59:32.692322800Z",
    "end" : "2026-09-11T20:59:44.913730100Z",
    "duration_ms" : 12221,
    "status" : "SUCCESS",
    "summary" : "21 document(s) pinned for 7 edge(s); 7 official migration guide(s)",
    "state_before" : "TARGET_FROZEN",
    "state_after" : "DOCUMENTATION_RETRIEVED",
    "attempt_directory" : "20260911-205932-757",
    "stop_reason" : null,
    "next_action" : "Run: bootshift knowledge",
    "command_count" : 0,
    "decision_count" : 0,
    "warning_count" : 0,
    "error_count" : 0,
    "unexecuted_step_count" : 0,
    "rendering_error" : null
  }, {
    "stage_id" : "08-knowledge",
    "stage_name" : "KnowledgeStage",
    "attempt_id" : "01M2949TD70HJMJ2T4V95CH3KB",
    "edge_id" : null,
    "trigger" : "PIPELINE",
    "start" : "2026-09-11T20:59:44.935608400Z",
    "end" : "2026-09-11T21:06:31.606702900Z",
    "duration_ms" : 406671,
    "status" : "SUCCESS",
    "summary" : "1691 migration fact(s): 1683 VERIFIED, 8 CANDIDATE, 0 CONFLICTING for 2.7.12 -> 3.5.16",
    "state_before" : "DOCUMENTATION_RETRIEVED",
    "state_after" : "KNOWLEDGE_VERIFIED",
    "attempt_directory" : "20260911-205944-957",
    "stop_reason" : null,
    "next_action" : "Run: bootshift impact",
    "command_count" : 286,
    "decision_count" : 0,
    "warning_count" : 1,
    "error_count" : 0,
    "unexecuted_step_count" : 0,
    "rendering_error" : null
  }, {
    "stage_id" : "09-impact",
    "stage_name" : "ImpactStage",
    "attempt_id" : "01M294P7M45YF96F39PCPF37CT",
    "edge_id" : null,
    "trigger" : "PIPELINE",
    "start" : "2026-09-11T21:06:31.684254Z",
    "end" : "2026-09-11T21:06:34.503357700Z",
    "duration_ms" : 2819,
    "status" : "SUCCESS",
    "summary" : "2072 impact finding(s) across 27 file(s); {DEFINITELY_AFFECTED=502, POSSIBLY_AFFECTED=4, UNAFFECTED_WITHIN_OBSERVED_COVERAGE=1566}",
    "state_before" : "KNOWLEDGE_VERIFIED",
    "state_after" : "IMPACT_ANALYZED",
    "attempt_directory" : "20260911-210631-780",
    "stop_reason" : null,
    "next_action" : "Run: bootshift characterize",
    "command_count" : 0,
    "decision_count" : 0,
    "warning_count" : 0,
    "error_count" : 0,
    "unexecuted_step_count" : 0,
    "rendering_error" : null
  }, {
    "stage_id" : "10-characterization",
    "stage_name" : "CharacterizationStage",
    "attempt_id" : "01M294PAD5FG2YMJ1M6W52P4DT",
    "edge_id" : null,
    "trigger" : "PIPELINE",
    "start" : "2026-09-11T21:06:34.533091200Z",
    "end" : "2026-09-11T21:10:21.862695400Z",
    "duration_ms" : 227329,
    "status" : "SUCCESS",
    "summary" : "82 executable scenario(s): 36 frozen against OLD, 46 unobservable, 0 unexecuted; 506 characterization contract(s): 0 frozen, 0 mapped to existing tests, 506 awaiting OLD, 0 unobservable",
    "state_before" : "IMPACT_ANALYZED",
    "state_after" : "CHARACTERIZATION_COMPLETE",
    "attempt_directory" : "20260911-210634-575",
    "stop_reason" : null,
    "next_action" : "Run: bootshift plan",
    "command_count" : 0,
    "decision_count" : 0,
    "warning_count" : 2,
    "error_count" : 0,
    "unexecuted_step_count" : 0,
    "rendering_error" : null
  }, {
    "stage_id" : "11-plan",
    "stage_name" : "PlannerStage",
    "attempt_id" : "01M294X8E6CGZXM1FCZS6KEF8H",
    "edge_id" : null,
    "trigger" : "PIPELINE",
    "start" : "2026-09-11T21:10:21.894565600Z",
    "end" : "2026-09-11T21:10:24.822891Z",
    "duration_ms" : 2928,
    "status" : "SUCCESS",
    "summary" : "8 edge(s) frozen, deterministic coverage 0.6791, 1 differential dimension(s) required",